主要内容,capacity,time,当前楼层,type,pasterid,secret,signature,htmlContent,effect,回复内容,回复着昵称,bmp,内容发布时间,修改时间,留言qq,留言者昵称,留言板ID？
现在开始渐渐体会了那句“你真正下决心要做一件事，全世界都会帮助你！”我要把这个计划坚持下去，一定把它实现！fighting！！！[em]e130[\/em],5832,,103,0,,0,,现在开始渐渐体会了那句“你真正下决心要做一件事，全世界都会帮助你！”我要把这个计划坚持下去，一定把它实现！fighting！！！\u003Cimg src=\u0022\/qzone\/em\/e130.gif\u0022  \/>\u003Cwbr  \/>,4194304,,,b8d095800100e209,2014/8/14 17:40,0,570381449,舒清,1000050039
今天算是真正领略到了信用卡的魅力，太神奇了！！！以前总是觉得用信用卡透支未来的钱做一个卡奴完全没必要！搞不好有了信用污点会毁了一生，但是现在发现只要在自己承受的范围内刷信用卡，把资金投入到低风险的理财产品中，将资金活动起来，使自己的生活可以更加高效和高质量！,5707,,102,0,,0,,今天算是真正领略到了信用卡的魅力，太神奇了！！！以前总是觉得用信用卡透支未来的钱做一个卡奴完全没必要！搞不好有了信用污点会毁了一生，但是现在发现只要在自己承受的范围内刷信用卡，把资金投入到低风险的理财产品中，将资金活动起来，使自己的生活可以更加高效和高质量！,0,,,b8d095800100e209,2014/8/10 21:03,0,570381449,舒清,1000050038
"公司不是养老院！没有永远和绝对的安稳，时刻保持危机意识，不断扩充自己，才是最根本的保障！
说得好！
[quote]引自：舒清  于 2014-08-06 23:03:16 发表的留言
引用内容：

才去研发工作室不到两个星期，回来就发现晓慧姐也辞职了，海龙哥下个月也要辞职了，辜文菁走了，钱江兵走了……曾经以为能够一起在工作奋战到底的伙伴们如今好像都在开始从自己身边离开了。他们去升学，转行，跳槽。感觉拓维只不过是大家职场的一个交汇点，大家有过短暂的相遇，然后又按照各自的行程向前推进着。自己在拓维会干多久，未来该怎么规划，万一今年手游部门搞得不好，被解散了怎么办？其实很值得自己思考一下了，而不是变得安逸，万一哪天公司效益不好，被解雇时还不知道下一步该怎么走，这个是比较恐怖的！柳哥的告诫和董嗲的坦白其实很真实：要么炒老板，要么被老板炒，都是双向选择，公司不是养老院！没有永远和绝对的安稳，时刻保持危机意识，不断扩充自己，才是最根本的保障！[\/quote]",5149,,101,0,,0,,公司不是养老院！没有永远和绝对的安稳，时刻保持危机意识，不断扩充自己，才是最根本的保障！\u003Cbr  \/>说得好！\u003Cbr  \/>\u003Cdiv class=\u0022comment_quote bor\u0022>引自：舒清&nbsp;&nbsp;于&nbsp;2014-08-06&nbsp;23:03:16&nbsp;发表的留言\u003Cbr  \/>引用内容：\u003Cbr  \/>\u003Cbr  \/>才去研发工作室不到两个星期，回来就发现晓慧姐也辞职了，海龙哥下个月也要辞职了，辜文菁走了，钱江兵走了……曾经以为能够一起在工作奋战到底的伙伴们如今好像都在开始从自己身边离开了。他们去升学，转行，跳槽。感觉拓维只不过是大家职场的一个交汇点，大家有过短暂的相遇，然后又按照各自的行程向前推进着。自己在拓维会干多久，未来该怎么规划，万一今年手游部门搞得不好，被解散了怎么办？其实很值得自己思考一下了，而不是变得安逸，万一哪天公司效益不好，被解雇时还不知道下一步该怎么走，这个是比较恐怖的！柳哥的告诫和董嗲的坦白其实很真实：要么炒老板，要么被老板炒，都是双向选择，公司不是养老院！没有永远和绝对的安稳，时刻保持危机意识，不断扩充自己，才是最根本的保障！\u003C\/div>,0,,,98d595840840a201,2014/8/7 22:56,0,376976240,骑行小蜗游,1000050037
才去研发工作室不到两个星期，回来就发现晓慧姐也辞职了，海龙哥下个月也要辞职了，辜文菁走了，钱江兵走了……曾经以为能够一起在工作奋战到底的伙伴们如今好像都在开始从自己身边离开了。他们去升学，转行，跳槽。感觉拓维只不过是大家职场的一个交汇点，大家有过短暂的相遇，然后又按照各自的行程向前推进着。自己在拓维会干多久，未来该怎么规划，万一今年手游部门搞得不好，被解散了怎么办？其实很值得自己思考一下了，而不是变得安逸，万一哪天公司效益不好，被解雇时还不知道下一步该怎么走，这个是比较恐怖的！柳哥的告诫和董嗲的坦白其实很真实：要么炒老板，要么被老板炒，都是双向选择，公司不是养老院！没有永远和绝对的安稳，时刻保持危机意识，不断扩充自己，才是最根本的保障！,5321,,100,0,,0,,才去研发工作室不到两个星期，回来就发现晓慧姐也辞职了，海龙哥下个月也要辞职了，辜文菁走了，钱江兵走了……曾经以为能够一起在工作奋战到底的伙伴们如今好像都在开始从自己身边离开了。他们去升学，转行，跳槽。感觉拓维只不过是大家职场的一个交汇点，大家有过短暂的相遇，然后又按照各自的行程向前推进着。自己在拓维会干多久，未来该怎么规划，万一今年手游部门搞得不好，被解散了怎么办？其实很值得自己思考一下了，而不是变得安逸，万一哪天公司效益不好，被解雇时还不知道下一步该怎么走，这个是比较恐怖的！柳哥的告诫和董嗲的坦白其实很真实：要么炒老板，要么被老板炒，都是双向选择，公司不是养老院！没有永远和绝对的安稳，时刻保持危机意识，不断扩充自己，才是最根本的保障！,0,,,b8d095800100e209,2014/8/6 23:03,0,570381449,舒清,1000050036
涨姿势了，通过rob的加币，现在才知道。原来现在加拿大的币都是塑料的。,5898,,99,0,,0,,涨姿势了，通过rob的加币，现在才知道。原来现在加拿大的币都是塑料的。,0,,,b8d095800100e209,2014/7/29 23:04,0,570381449,舒清,1000050035
新的一周，ganbadei..,5945,,98,0,,0,,新的一周，ganbadei..,0,,,18d495800200c101,2014/7/14 16:58,0,1311565453,槭树絮语,1000050032
慎独，慎言，慎行……,5698,1404712852,97,0,,0,,慎独，慎言，慎行……,32,热烈欢迎啊，我的梦想就要洒在这片热土上了。。[em]e120[\/em],槭树絮语,18d495800200c101,2014/7/7 13:56,0,1311565453,槭树絮语,1000050030
到底是自己犯贱，还是过于依赖？现在开始明白习惯是一种可怕的东西，一旦逐渐形成便难以改变。我想我要反思了，而不是去继续习惯与依赖，自己的的想法不一定就是别人想要的。要学会开始充实自己，学会慎独，好好利用时间，不要再去虚度。无聊，空虚，寂寞，幻想是因为没有设定具体的目标，没有动力，这是一种危险的信号。,5667,,96,0,,0,,到底是自己犯贱，还是过于依赖？现在开始明白习惯是一种可怕的东西，一旦逐渐形成便难以改变。我想我要反思了，而不是去继续习惯与依赖，自己的的想法不一定就是别人想要的。要学会开始充实自己，学会慎独，好好利用时间，不要再去虚度。无聊，空虚，寂寞，幻想是因为没有设定具体的目标，没有动力，这是一种危险的信号。,0,,,b8d095800100e209,2014/7/6 23:53,0,570381449,舒清,1000050029
清哥最近工作进展的怎么样啊~！,5720,1403848964,95,0,,0,,清哥最近工作进展的怎么样啊~！,32,是韩国开发的同名手游，我们公司买了韩国的版权，准备今年在中国发行，现在在内测。,舒清,18d495800200c101,2014/6/27 9:59,0,1311565453,槭树絮语,1000050027
跑到清哥留言板下胡言乱语。哈哈,5900,1402111705,94,0,,0,,跑到清哥留言板下胡言乱语。哈哈,4194336,花妹到此一游。。,舒清,18d495800200c101,2014/6/7 11:18,0,1311565453,槭树絮语,1000050025
多日未见你留言啊，也不见你妹子留言啊~,5865,1401059285,93,0,,0,,多日未见你留言啊，也不见你妹子留言啊~,32,哈哈，最近留言板玩的不多，开始玩沪江了。。,舒清,98d595840840a201,2014/5/25 23:55,0,376976240,骑行小蜗游,1000050024
感谢你为我们所做的一切  我们都记在心里  以后保持联络,5876,1399643212,92,0,,0,,感谢你为我们所做的一切&nbsp;&nbsp;我们都记在心里&nbsp;&nbsp;以后保持联络,32,好的，友谊万古常青！,舒清,184085800000c001,2014/5/9 15:17,0,672510295,陈建平,1000050023
芬兰开发团队因为过复活节周二才上班，这么爽啊！,5919,,91,0,,0,,芬兰开发团队因为过复活节周二才上班，这么爽啊！,4194304,,,b8d095800100e209,2014/4/18 12:44,0,570381449,舒清,1000050022
看来你在公司过得很不错啊~,5707,1397649768,90,0,,0,,看来你在公司过得很不错啊~,32,回来好好交流一下吧。对了 论文是5月12号答辩？确定了？,骑行小蜗游,98d595840840a201,2014/4/16 19:57,0,376976240,骑行小蜗游,1000050021
今天会议发现，高手的确很多。务必保持努力学习的状态！,5913,,89,0,,0,,今天会议发现，高手的确很多。务必保持努力学习的状态！,4194304,,,b8d095800100e209,2014/4/15 13:28,0,570381449,舒清,1000050020
公司宿舍环境没让我失望，好的公司就是不一样啊。,5919,,88,0,,0,,公司宿舍环境没让我失望，好的公司就是不一样啊。,4194304,,,b8d095800100e209,2014/4/12 15:37,0,570381449,舒清,1000050019
"让优秀成为一种习惯！
[quote]引自：李游  于 2014-04-08 19:40:58 发表的留言
引用内容：

如何让自己变得优秀，你是最好的模板~[\/quote]",5832,,87,0,,0,,让优秀成为一种习惯！\u003Cbr  \/>\u003Cdiv class=\u0022comment_quote bor\u0022>引自：李游&nbsp;&nbsp;于&nbsp;2014-04-08&nbsp;19:40:58&nbsp;发表的留言\u003Cbr  \/>引用内容：\u003Cbr  \/>\u003Cbr  \/>如何让自己变得优秀，你是最好的模板~\u003C\/div>,0,,,b8d095800100e209,2014/4/8 23:13,0,570381449,舒清,1000050018
如何让自己变得优秀，你是最好的模板~,5928,,86,0,,0,,如何让自己变得优秀，你是最好的模板~,0,,,98d595840840a201,2014/4/8 19:40,0,376976240,骑行小蜗游,1000050017
"告诉你了内心世界的大门，你就没事来客串啊。
[quote]引自：猪花妹  于 2014-04-03 09:12:20 发表的留言
引用内容：

我是来窥探内心世界的！！！哈哈。。。[em]e120[\/em][\/quote]",5794,,85,0,,0,,告诉你了内心世界的大门，你就没事来客串啊。\u003Cbr  \/>\u003Cdiv class=\u0022comment_quote bor\u0022>引自：猪花妹&nbsp;&nbsp;于&nbsp;2014-04-03&nbsp;09:12:20&nbsp;发表的留言\u003Cbr  \/>引用内容：\u003Cbr  \/>\u003Cbr  \/>我是来窥探内心世界的！！！哈哈。。。\u003Cimg src=\u0022\/qzone\/em\/e120.gif\u0022  \/>\u003Cwbr  \/>\u003C\/div>,0,,,b8d095800100e209,2014/4/3 16:34,0,570381449,舒清,1000050016
"恭喜恭喜啊~拓维在长沙也是很不错的公司哦~是做什么工作？什么时候上班呢？
[quote]引自：舒清  于 2014-04-02 23:07:10 发表的留言
引用内容：

如愿拿到拓维offer,开心！[\/quote]",5739,1396501432,84,0,,0,,"恭喜恭喜啊~拓维在长沙也是很不错的公司哦~是做什么工作？什么时候上班呢？\u003Cbr  \/>\u003Cdiv class=\u0022comment_quote bor\u0022>引自：舒清&nbsp;&nbsp;于&nbsp;2014-04-02&nbsp;23:07:10&nbsp;发表的留言\u003Cbr  \/>引用内容：\u003Cbr  \/>\u003Cbr  \/>如愿拿到拓维offer,开心！\u003C\/div>",32,是做手游测试。4月中旬开始去实习。,舒清,98d595840840a201,2014/4/3 12:30,0,376976240,骑行小蜗游,1000050015
我是来窥探内心世界的！！！哈哈。。。[em]e120[\/em],5916,,83,0,,0,,我是来窥探内心世界的！！！哈哈。。。\u003Cimg src=\u0022\/qzone\/em\/e120.gif\u0022  \/>\u003Cwbr  \/>,0,,,18d495800200c101,2014/4/3 9:12,0,1311565453,槭树絮语,1000050014
"如愿拿到拓维offer,开心！",5941,,82,0,,0,,"如愿拿到拓维offer,开心！",0,,,b8d095800100e209,2014/4/2 23:07,0,570381449,舒清,1000050013
啊清啊  你也在留言板上开始矫情了啊~,5875,1396242272,81,0,,0,,啊清啊&nbsp;&nbsp;你也在留言板上开始矫情了啊~,32,像你学习下，觉得你这个创意不错哦。,舒清,98d595840840a201,2014/3/31 12:41,0,376976240,骑行小蜗游,1000050012
感情难道需要被证明吗？能证明是也许只有时间吧，原来异性缘好也是一种错。。。,5891,,80,0,,0,,感情难道需要被证明吗？能证明是也许只有时间吧，原来异性缘好也是一种错。。。,0,,,b8d095800100e209,2014/3/26 18:59,0,570381449,舒清,1000050011
昨晚又没睡好，上午投了晟通的电商技术岗位，下周二去公司面试。下午狂睡了4小时补觉，晚上还要去找她，昨天的话也许说得没有逻辑，跟她聊聊吧。。。[img]http:\/\/p.qpic.cn\/wallwatermark\/0\/13954766299561449\/0[\/img],5763,,79,0,,0,,昨晚又没睡好，上午投了晟通的电商技术岗位，下周二去公司面试。下午狂睡了4小时补觉，晚上还要去找她，昨天的话也许说得没有逻辑，跟她聊聊吧。。。\u003Ca href=\u0022http:\/\/p.qpic.cn\/wallwatermark\/0\/13954766299561449\/0\u0022 target=\u0022_blank\u0022>\u003Cimg src=\u0022http:\/\/p.qpic.cn\/wallwatermark\/0\/13954766299561449\/0\u0022  \/>\u003C\/a>\u003Cwbr  \/>,0,,,b8d095800100e209,2014/3/22 16:22,0,570381449,舒清,1000050010
哎，她有那种感觉，我又何尝不是如此呢？感情世界里最怕内心有隔阂。,5901,,78,0,,0,,哎，她有那种感觉，我又何尝不是如此呢？感情世界里最怕内心有隔阂。,4194304,,,b8d095800100e209,2014/3/22 1:15,0,570381449,舒清,1000050009
今天一大早冒着大雨去中南宣讲会，却取消了。。。澹,5915,,77,0,,0,,今天一大早冒着大雨去中南宣讲会，却取消了。。。澹,4194304,,,b8d095800100e209,2014/3/19 12:14,0,570381449,舒清,1000050008
哈哈，留言板是个不错的地方，只有真正对你关注的人才会看你的留言板。有道理！我想以后有什么心情可以发在留言板，让真正想关注我的人看到我的内心。[em]e129[\/em],5812,,76,0,,0,,哈哈，留言板是个不错的地方，只有真正对你关注的人才会看你的留言板。有道理！我想以后有什么心情可以发在留言板，让真正想关注我的人看到我的内心。\u003Cimg src=\u0022\/qzone\/em\/e129.gif\u0022  \/>\u003Cwbr  \/>,0,,,b8d095800100e209,2014/3/15 17:18,0,570381449,舒清,1000050007
看到高中好友被他女友发说说检讨感觉好无语，怎么会那样呢？看不出来啊，哎，感情还是专一的好，珍惜现在所拥有的，脚踏几条船总有一天会掉水里淹死的。。,5819,,75,0,,0,,看到高中好友被他女友发说说检讨感觉好无语，怎么会那样呢？看不出来啊，哎，感情还是专一的好，珍惜现在所拥有的，脚踏几条船总有一天会掉水里淹死的。。,0,,, 8c19c8000000401,2014/3/15 17:15,0,846322979,清风,1000050006
看完了结婚吧，结局都是美好的。佩服果然那种耐心和灵活，工作方面接到了红网的笔试通知，该突击突击下了。加油！[em]e129[\/em],5844,,74,0,,0,,看完了结婚吧，结局都是美好的。佩服果然那种耐心和灵活，工作方面接到了红网的笔试通知，该突击突击下了。加油！\u003Cimg src=\u0022\/qzone\/em\/e129.gif\u0022  \/>\u003Cwbr  \/>,4194304,,, 8c19c8000000401,2014/3/14 17:21,0,846322979,清风,1000050005
今天体验了无领导小组讨论，感觉还不错，现在开始走校招路线，推掉本地小私营企业面试。另外，对于她我也不知道为什么，不怎么想跟她主动联系了，或许是对她特殊性格的对抗吧。我现在也只想把工作的事情摆在第一位了，加油！,5755,,73,0,,0,,今天体验了无领导小组讨论，感觉还不错，现在开始走校招路线，推掉本地小私营企业面试。另外，对于她我也不知道为什么，不怎么想跟她主动联系了，或许是对她特殊性格的对抗吧。我现在也只想把工作的事情摆在第一位了，加油！,4194304,,, 8c19c8000000401,2014/3/13 23:56,0,846322979,清风,1000050004
新年快乐哟。[em]e113[\/em],5901,1391136058,72,0,,0,,新年快乐哟。\u003Cimg src=\u0022\/qzone\/em\/e113.gif\u0022  \/>\u003Cwbr  \/>,4194336,谢谢，也祝你马年吉祥！,舒清,38d495a00142e029,2014/1/30 9:52,0,1092214057,刘园园,1000050003
哈哈，欢迎来我空间听歌，我又换歌啦,5631,1387855745,71,0,,0,,哈哈，欢迎来我空间听歌，我又换歌啦,32,[em]e113[\/em],b若有似无的小矜持。,18d08d840008c309,2013/12/15 14:40,0,525355863,b若有似无的小矜持。,1000050002
《再遇见》,5818,1386425598,70,0,,0,,《再遇见》,32,哈哈，不愧是表情哥，觉悟高呀,b若有似无的小矜持。,18d08d840008c309,2013/12/7 21:16,0,525355863,b若有似无的小矜持。,1000050001
表情哥哇~,5917,1386306607,69,0,,0,,表情哥哇~,32,啥情况？,舒清,18d08d840008c309,2013/12/4 12:01,0,525355863,b若有似无的小矜持。,1000050000
你是名副其实的励志哥啊[em]e113[\/em],5901,1383922379,68,0,,0,,你是名副其实的励志哥啊\u003Cimg src=\u0022\/qzone\/em\/e113.gif\u0022  \/>\u003Cwbr  \/>,32,没有啦。。,舒清,18c0dd800000e201,2013/10/29 13:31,0,874409496,阳光不锈,72
"[em]e192[\/em] 学长学长[img,180,180]http:\/\/qzonestyle.gtimg.cn\/qzone\/em\/recommendedImages\/024.png[\/img]",5835,1379951978,67,0,,0,,\u003Cimg src=\u0022\/qzone\/em\/e192.gif\u0022  \/>\u003Cwbr  \/>&nbsp;学长学长\u003Ca href=\u0022http:\/\/qzonestyle.gtimg.cn\/qzone\/em\/recommendedImages\/024.png\u0022 target=\u0022_blank\u0022>\u003Cimg src=\u0022http:\/\/qzonestyle.gtimg.cn\/qzone\/em\/recommendedImages\/024.png\u0022 width=\u0022180\u0022 height=\u0022180\u0022  \/>\u003C\/a>\u003Cwbr  \/>,32,[em]e129[\/em],舒清,18d195800200c101,2013/9/23 23:41,0,1375670704,黑~白 白~黑,71
我比较感兴趣的是，你骑自习车回老家共用了多少时间啊，晚上是住旅馆还是睡帐篷呢，你比较喜欢户外活动吧，用心生活的人啊，享受后很是喜欢将感悟付诸文字与人分享哦，个人觉得这个想法还是很不错的，你们去武功山是挑阴雨天去的还是恰好碰上阴雨天，因为还没去过，所以希望能给与点天气方面的建议,5377,1370301218,66,0,,0,,我比较感兴趣的是，你骑自习车回老家共用了多少时间啊，晚上是住旅馆还是睡帐篷呢，你比较喜欢户外活动吧，用心生活的人啊，享受后很是喜欢将感悟付诸文字与人分享哦，个人觉得这个想法还是很不错的，你们去武功山是挑阴雨天去的还是恰好碰上阴雨天，因为还没去过，所以希望能给与点天气方面的建议,4194336,打雷的天气去，那是找虐好吗,半研墨,18c495800000c001,2013/6/3 7:05,0,672267829,半研墨,70
"嘿，舒舒服服，清清楚楚！
追求自己想要的生活，要开心，要幸福！[em]e130[\/em]",5803,1365398421,65,0,,0,,嘿，舒舒服服，清清楚楚！\u003Cbr  \/>追求自己想要的生活，要开心，要幸福！\u003Cimg src=\u0022\/qzone\/em\/e130.gif\u0022  \/>\u003Cwbr  \/>,32,呵呵，没有呢，找工作！,朝★暮Z,18d095a00002c201,2013/4/7 14:22,0,89178101,朝★暮Z,69
表情哥，今天是除夕，提前祝你新年快乐哦,5853,1360383375,64,0,,0,,表情哥，今天是除夕，提前祝你新年快乐哦,32,嗯，谢谢，祝你也新年身体健康！！[em]e113[\/em],舒清,18d08d840008c309,2013/2/9 10:58,0,525355863,b若有似无的小矜持。,68
学长兼老乡，我来了哦，圣诞快乐哦，都不去我哪里踩踩，留下言[em]e149[\/em] 还有要加油哦要幸福哦[em]e121[\/em],5860,,63,0,,0,,学长兼老乡，我来了哦，圣诞快乐哦，都不去我哪里踩踩，留下言\u003Cimg src=\u0022\/qzone\/em\/e149.gif\u0022  \/>\u003Cwbr  \/>&nbsp;还有要加油哦要幸福哦\u003Cimg src=\u0022\/qzone\/em\/e121.gif\u0022  \/>\u003Cwbr  \/>,0,,,d85495800300c121,2012/12/25 11:35,0,2406750635,珂声紫陌空[em]e327809[\/em],67
过来瞧瞧~哈哈~[em]e192[\/em][em]e192[\/em][em]e195[\/em],5875,1354424769,62,0,,0,,过来瞧瞧~哈哈~\u003Cimg src=\u0022\/qzone\/em\/e192.gif\u0022  \/>\u003Cwbr  \/>\u003Cimg src=\u0022\/qzone\/em\/e192.gif\u0022  \/>\u003Cwbr  \/>\u003Cimg src=\u0022\/qzone\/em\/e195.gif\u0022  \/>\u003Cwbr  \/>,32,欢迎欢迎，热烈欢迎！,舒清, 8d095a40002c101,2012/11/30 21:31,0,781091277,双鱼孟,65
我有一个心愿：2012年11月11日之前，有人打电话对我说：“这个节咱不过，好吗？”呵呵，那你的心愿呢？,5871,,61,0,,0,,我有一个心愿：2012年11月11日之前，有人打电话对我说：“这个节咱不过，好吗？”呵呵，那你的心愿呢？,0,,,38d495a00142e029,2012/11/10 22:53,0,1092214057,刘园园,64
我有一个心愿：2012年11月11日之前，有人打电话对我说：“这个节咱不过，好吗？”呵呵，那你的心愿呢？,5871,,60,0,,0,,我有一个心愿：2012年11月11日之前，有人打电话对我说：“这个节咱不过，好吗？”呵呵，那你的心愿呢？,0,,,38d495a00142e029,2012/11/10 22:53,0,1092214057,刘园园,63
加油,5954,,59,0,,0,,加油,0,,,18d49d8c0002e201,2012/10/4 12:39,0,782285746,じ彩虹の,62
加油加油,5950,,58,0,,0,,加油加油,0,,,18d49d8c0002e201,2012/10/4 12:39,0,782285746,じ彩虹の,61
怎么还没出来啊,5944,,57,0,,0,,怎么还没出来啊,0,,,18d49d8c0002e201,2012/10/4 12:27,0,782285746,じ彩虹の,60
哥们中秋快乐！很高兴能看到你的空间，回常德了吧！和你一样我是个90后学生，同样喜欢旅游，想从常德骑自行车回宁乡，希望能得到你的帮助。,5548,1349172509,56,0,,0,,哥们中秋快乐！很高兴能看到你的空间，回常德了吧！和你一样我是个90后学生，同样喜欢旅游，想从常德骑自行车回宁乡，希望能得到你的帮助。,32,"哦！单车闯关节目应该挺不错的吧！回常德了打我电话咯 一起去玩  我就在湖南文理

",胡昂,88c185800202c001,2012/9/30 22:05,0,2691826986,胡昂,59
"[ft=#0000ff,4,楷体_GB2312] 要有痛感，才有存在感，有人虐身，有人虐心。[\/ft]",5893,,55,0,,0,,\u003Cspan style=\u0022line-height:1.8em;font-family:楷体_gb2312;font-size:18px;color:#0000ff;\u0022>&nbsp;要有痛感，才有存在感，有人虐身，有人虐心。\u003C\/span>\u003Cwbr  \/>,4194304,,,18d09da40000c001,2012/9/26 1:41,0,569459320,Shmily,58
来看看你  [em]e130[\/em],5938,,54,0,,0,,来看看你&nbsp;&nbsp;\u003Cimg src=\u0022\/qzone\/em\/e130.gif\u0022  \/>\u003Cwbr  \/>,4194304,,, 8809c0002008001,2012/9/21 0:22,0,2246227813,倩倩牛气冲天,57
        那着实是一段难忘而美好的旅程，着实让人敬佩。[em]e179[\/em],5894,,53,0,,0,,&nbsp;&nbsp;&nbsp;&nbsp;&nbsp;&nbsp;&nbsp;&nbsp;那着实是一段难忘而美好的旅程，着实让人敬佩。\u003Cimg src=\u0022\/qzone\/em\/e179.gif\u0022  \/>\u003Cwbr  \/>,0,,,98d595a00100e209,2012/9/19 0:18,0,475445219,【HONEST＞》。,56
清哥哥，你好棒哦，你现在是越来越有那种・・・・・・・・・・加油,5857,1344479120,52,0,,0,,清哥哥，你好棒哦，你现在是越来越有那种・・・・・・・・・・加油,32,[em]e130[\/em]什么时候过来玩啊。,舒清,18c0958401008201,2012/8/7 22:36,0,646544084,Krystal,55
表情哥，好无聊啊,5933,,51,0,,0,,表情哥，好无聊啊,0,,,18d08d840008c309,2012/7/21 16:37,0,525355863,b若有似无的小矜持。,53
还好啊，老同学,5949,,50,0,,0,,还好啊，老同学,4195328,,,18c195a00002e309,2012/6/13 23:56,0,172428195,最美的时光,52
羡慕嫉妒恨。。。,5949,,49,0,,0,,羡慕嫉妒恨。。。,0,,,1.85E+112,2012/5/22 14:35,0,1185938901,戈娇,51
礼物在哪啊？没看到啊,5751,1336102563,48,0,,0,,礼物在哪啊？没看到啊,32,嘿嘿，好的哦，我回家啦，嘻嘻，可以用电脑哦,b若有似无的小矜持。,18d08d840008c309,2012/5/4 7:58,0,525355863,b若有似无的小矜持。,50
看了你的空间，对你这个人实在是佩服呢。相信你会更加厉害的。,5909,,47,0,,0,,看了你的空间，对你这个人实在是佩服呢。相信你会更加厉害的。,0,,,38d495a00142e029,2012/4/5 12:11,0,1092214057,刘园园,49
"哟西  啊清啊  很好啊~  我都把变形记日志评论写到这里来了   
大学还准备做啥子生意不，那单车还搞不搞哩？",5729,1332164751,46,0,,0,,哟西&nbsp;&nbsp;啊清啊&nbsp;&nbsp;很好啊~&nbsp;&nbsp;我都把变形记日志评论写到这里来了&nbsp;&nbsp;&nbsp;\u003Cbr  \/>大学还准备做啥子生意不，那单车还搞不搞哩？,32,"现在在各种探索道路中......作兼职的目的是为了启动资金和吸收经验.单车生意目前还处于调查阶段,我会抽个周末去高桥看看",舒清,98d595840840a201,2012/3/19 21:05,0,376976240,骑行小蜗游,48
留脚印，发现你自己写了好多日志哦，而且都写得好好，[em]e179[\/em],5865,1331911579,45,0,,0,,留脚印，发现你自己写了好多日志哦，而且都写得好好，\u003Cimg src=\u0022\/qzone\/em\/e179.gif\u0022  \/>\u003Cwbr  \/>,32,谢谢，欢迎来踩踩！,舒清,1.85E+112,2012/3/16 23:21,0,1185938901,戈娇,47
